{
  "$schema": "http://json-schema.org/draft-07/schema#",
  "$id": "newsletter",
  "title": "NYC PolicyScope Newsletter Content",
  "description": "Strict schema for all AI-generated newsletter content. Every field is required.",
  "type": "object",
  "required": [
    "subject_line",
    "preview_text",
    "nyc_updates",
    "main_insight",
    "feature_title",
    "feature_body",
    "quick_tips",
    "cta_text"
  ],
  "additionalProperties": false,
  "properties": {
    "subject_line": {
      "type": "string",
      "minLength": 10,
      "maxLength": 80,
      "description": "Email subject line. Clear and specific. No clickbait."
    },
    "preview_text": {
      "type": "string",
      "minLength": 20,
      "maxLength": 140,
      "description": "Preview text shown in inbox after subject. Summarizes 2-3 stories."
    },
    "nyc_updates": {
      "type": "array",
      "minItems": 1,
      "maxItems": 8,
      "description": "Short borough-level news blocks. At least one required.",
      "items": {
        "type": "object",
        "required": ["borough", "body"],
        "additionalProperties": false,
        "properties": {
          "borough": {
            "type": "string",
            "enum": ["Manhattan", "Brooklyn", "Queens", "Bronx", "Staten Island", "Citywide"],
            "description": "NYC borough or 'Citywide' for cross-borough stories."
          },
          "body": {
            "type": "string",
            "minLength": 30,
            "maxLength": 400,
            "description": "1-3 sentences. Factual, local, useful. No hype."
          }
        }
      }
    },
    "main_insight": {
      "type": "string",
      "minLength": 50,
      "maxLength": 600,
      "description": "1-2 paragraph editorial insight connecting themes across this week's updates."
    },
    "feature_title": {
      "type": "string",
      "minLength": 5,
      "maxLength": 100,
      "description": "Title of the featured deep-dive article."
    },
    "feature_body": {
      "type": "string",
      "minLength": 100,
      "maxLength": 1200,
      "description": "2-4 paragraphs. Substantive but readable. Local policy focus."
    },
    "quick_tips": {
      "type": "array",
      "minItems": 2,
      "maxItems": 5,
      "description": "Short actionable items: links, deadlines, resources.",
      "items": {
        "type": "string",
        "minLength": 10,
        "maxLength": 200
      }
    },
    "cta_text": {
      "type": "string",
      "minLength": 20,
      "maxLength": 300,
      "description": "Soft call to action. Community-oriented. No hard sales."
    }
  }
}
